stt,thema
얇은 고기는 그릴이 좋은데 스테이크 고기는 후라이팬이 나아 내 취향이지만,스테이크 잘 굽는 법 
응 맞아 그렇지 않으면 온도 차이가 너무 심해서 그냥 타버리기 십상이야,스테이크 잘 굽는 법 
밑간을 할 때는 피부에 스킨 바르듯이 톡톡톡 두드리면서 올리브 오일이 살 속으로 들어가게 한참 두드려줘야 해 ,스테이크 잘 굽는 법 
응 스테이크 고기를 썰면 밖은 검고 안은 핑크빛 살이 보이지 ,스테이크 잘 굽는 법 
그것도 맛 들이면 맛있어 그리고 그건 피가 아니고 육즙이야,스테이크 잘 굽는 법 
그게 엄청 빠른 거야 보통 백신 하나 만드는데 십 년씩은 걸린대,코로나백신 시험 지원자
응 그래서 일상 이상 삼상 이렇게 여러 단계를 거치는 거야 ,코로나백신 시험 지원자
(NO:) 그런데 임상 시험 지원자들 나서는 거 보니까 뭔가 뭉클하더라,코로나백신 시험 지원자
응 내가 본 건 미국 (NO:어느 목사님이) 구십이 세인데 (NO:시험자로) 나섰(NO:더라고),코로나백신 시험 지원자
외국에서는 백신 시험자 모집 뉴스가 많던데 우리나라는 없나,코로나백신 시험 지원자
근데 백신 개발이 하도 경쟁이 심하니까 러시아 중국 미국 그런 나라들 기사들이 좀 다 부왕부왕해 ,코로나백신 시험 지원자
미국도 그렇고 중국도 그렇고 삼상 실험 지원자 모집 몇 백 명 막 이래 ,코로나백신 시험 지원자
(NO:)정말 우리나라에서 백신 개발되면 그야말로 방역 강대국이 될 텐데,코로나백신 시험 지원자
아무리 잘한다고 해도 기초 의학이나 바이오 이런 데에 투자가 적은 거 아닐까,코로나백신 시험 지원자
(NO:그나마) 코로나 바이러스는 변이가 생겨도 백신을 무력화할 만큼 그렇게 변이가 심한 바이(NO:러스는) 아니라네,코로나백신 시험 지원자
우린 그저 (NO:손) 잘 씻고 건강 잘 챙기고 과학자들을 응원하자,코로나백신 시험 지원자
어떤 게 나오더라 아 그거 아닌가 남편이 게임하니까 전원 꺼버리는,광고 트렌드
아 결혼해도 (NO:비울 수 없는 방이 있습니다) 뭐 그런 거 아니야,광고 트렌드
세상이 팍팍해질수록 그런 감성적인 게 빛을 발휘하나 봐 ,광고 트렌드
이 제작자 감각이 남다르네 말 그대로 인문학으로 광고한다 이거네,광고 트렌드
참 나 우리 학교 다닐 때는 (NO:신문 사설 읽고 논술 공부하고 그랬는데 ),뉴스 다이어트 방법
응 그건 공감해 너무 자극적이야 (SN:)그래서 어떻게 하래,뉴스 다이어트 방법
하긴 요즘 티비 뉴스 보면 정말 곧 무슨 일 날 거 같잖아 ,뉴스 다이어트 방법
응 말 되는 이야기다 정말 쓸데 없는 뉴스 진짜 많이 보게 되잖아 ,뉴스 다이어트 방법
맞아 어르신들 하루 종일 유튜브 보는 분들 많잖아 ,뉴스 다이어트 방법
그러니까 인터넷이 생겨서 (NO:좋은 점도) 많지만 참 어려운 것도 (NO:많아졌어 )(NO:),뉴스 다이어트 방법
응 뭔가 보이지 않는 손에 의해서 우리가 생각하고 행동하게 된다고나 할까,뉴스 다이어트 방법
처음에는 그랬는데 코로나 퍼지기 시작하면서 확 퍼진 거 같아,엠비티아이(MBTI) 유행 이유
나름 그런 (NO:거) 같아 이미 만들어진 건 팔십 년이 넘은 심리 테스트야 ,엠비티아이(MBTI) 유행 이유
그게 핵심이긴 하지 외향성 내향성 감각 직관 사고 감정 판단 인식 이렇게 네 가지로 나뉘는 거야 ,엠비티아이(MBTI) 유행 이유
(NO:그게) 재밌더라 요즘 젊은이 사이에서 유행하는 게 그거 맞추는 놀이 같은 거래 ,엠비티아이(MBTI) 유행 이유
그렇다니까 표가 쫙 나와있어서 그거 보고 잘 맞는다 아니다 그런 거 한대 ,엠비티아이(MBTI) 유행 이유
그만큼 인간에 대한 이해의 폭이 좁아지겠군 맞네 그 의견,엠비티아이(MBTI) 유행 이유
이엔에프제이가 정의로운 (NO:사회운동가 이런 거거든 딱이지) 않아,엠비티아이(MBTI) 유행 이유
(NO:)그래서 나는 코로나 확 퍼지면서 이게 퍼진 것도 그럴만하겠다 그런 생각이 들더라고 ,엠비티아이(MBTI) 유행 이유
(NO:)그래 그거야 그렇다면 좋은 영향이 되지 않을까,엠비티아이(MBTI) 유행 이유
이거 덕에 사람들이 반성하는 시간을 (NO:가졌)으면 좋겠다 ,엠비티아이(MBTI) 유행 이유
안 그런 사람도 (NO:많다는 게) 함정이지 ,엠비티아이(MBTI) 유행 이유
그런 의미에서 검사나 한 번 받아 보지,엠비티아이(MBTI) 유행 이유
응 인터넷에 들어가면 바로 해볼 수 있어 ,엠비티아이(MBTI) 유행 이유
처음엔 다 어려(NO:워) 왜 (NO:뭐) 글 써야할 일 있어,백지 공포증 극복하기 
그 정도면 꽤 긴 글인데 ,백지 공포증 극복하기 
그걸 백지 공포증이라고 해 ,백지 공포증 극복하기 
병명까지는 아니지만 시작이 어려운 걸 그리 (NO:말하더라고) ,백지 공포증 극복하기 
우선 네가 쓰고 싶은 글의 주제를 정해야지 ,백지 공포증 극복하기 
오 차원이 높은데 주제를 정했으면 그냥 쓰려고 하지 말고 에피소드들을 모아 봐 ,백지 공포증 극복하기 
(NO:강원국씨라고) 글쓰기 강사로 유명한 사람 있거든,백지 공포증 극복하기 
그래 맞아 그 사람 (NO:강연) 중에 팁을 말해주는데 도움이 될 거 (NO:같아 ),백지 공포증 극복하기 
글 쓸 키워드를 찾은 다음에 인터넷 서치를 먼저 한대 ,백지 공포증 극복하기 
그렇지 그렇게 칼럼 열 개 정도 보고 나서 자기 생각을 쓰기 시작한대 ,백지 공포증 극복하기 
그럴 수도 있겠지만 참고만 한다 생각하면 뭐,백지 공포증 극복하기 
아니 아니 (NO:그게 제일 큰 문제야) 글은 구조야 무슨 이야기로 시작해서 어떻게 (NO:흐름을) 잡느냐가 글쓰기의 핵심이지  ,백지 공포증 극복하기 
바로 그거야 글을 종이에 쓰는 게 아니야 머리에 먼저 써야지 ,백지 공포증 극복하기 
응 그런 다음에 순서별로 붙이는 거야 그러면 구조가 한 눈에 들어오잖아 ,백지 공포증 극복하기 
응 이렇게도 붙여보고 저렇게도 붙여보면서 구조를 만들어 봐 정말 도움이 많이 될 거야 ,백지 공포증 극복하기 
(NO:응) 그 포스트잇 구조를 옆에 (NO:두고) 조금씩 써가는 거지 ,백지 공포증 극복하기 
(NO:)그래 너무 바쁘게 살고 그러면 (NO:) (NO:점점) 공감 능력이 떨어지는 법이야,공감력 높이기 
공감은 타인에 대한 생각을 하는 데서 시작하는데 그럴 시간을 허락하지 않은 거지,공감력 높이기 
그런 건 아직 못 본거 같고 어느 대학 커리큘럼에 재미있는 게 있더라,공감력 높이기 
그래 시를 잃은 그대에게 그 베스트셀러 책도 공대생들에게 시를 가르치는 수업이었잖아 ,공감력 높이기 
시를 읽는 것도 좋은데 시를 베껴 쓰기를 해 봐 느낌이 확 달라져 ,공감력 높이기 
요즘 글씨 안써서 글씨체 다 망가지잖아 (NO:그런 데에도) 효과가 있어 ,공감력 높이기 
음 정기적으로 하는 게 좀 부담이 된다면 소설을 읽어 (NO:봐),공감력 높이기 
그럼 어떤 작가는 그런 말 하더라 (NO:우리나라 정치가 잘 되려면) 정치인이 소설을 읽어야 (NO:한다고 ),공감력 높이기 
맞아 그래서 소설을 읽으면 공감 (NO:능력이 있다고) 얘기하는 거야 ,공감력 높이기 
날 못 믿는구나 실제로 외국에서 그런 연구를 했던 걸 본 적이 있어 ,공감력 높이기 
다행이야 지난번에 만난 사람은 그런 말 하더라 자기는 니 자식이라면 그러겠니 이런 말이 제일 싫대 ,공감력 높이기 
자기 자식이어야 공감하고 이해하는 우리 사회의 얄팍함이 싫단 얘기였어,공감력 높이기 
그런 거지 자식 이야기까지 끌어 내지 않아도 공감해야 하는 문제가 많다는 거지 ,공감력 높이기 
맞아 아무 이해 없이도 충분히 공감하고 용감한 일에 뛰어드는 사람들 그런 사람들이 많아져야 할텐데,공감력 높이기 
그러려면 일을 좀 줄이는 것도 방법인거 같아 사색의 시간이 필요하잖아,공감력 높이기 
예전에는 친구였더라 존경심과 경외심을 동시에 갖고 있다 그렇게 말했지 ,경쟁심의 명과 암
응 스포츠의 세계에선 사실 이런 점을 이용하기도 하는 거 같아 ,경쟁심의 명과 암
그치 성적으로만 기억되는 더러운 세상 뭐 이런 거잖아 ,경쟁심의 명과 암
그렇지 우리의 능력은 우리가 생각하는 것 이상일 때가 종종 있으니까,경쟁심의 명과 암
그래도 이렇게 (NO:솔직하게) 얘기하는 거 보니까 멘탈도 나쁘지 않네 ,경쟁심의 명과 암
사실 난 (NO:경쟁심이 너무 강해서 경쟁을 피하거든) 날 통제하지 못할 거 같아서 ,경쟁심의 명과 암
(SN:)마인드 (NO:컨트롤)이랄 건 없고 쓸데없는 잡념이 들면 그냥 걸어 (NO:),경쟁심의 명과 암
명상까지는 아니고 한 시간쯤 부지런히 걸으면 생각이 점점 정리되는 기분이 느껴져 ,경쟁심의 명과 암
(NO:)(NO:너는) 그냥 경쟁 속으로 뛰어들어 넌 그럴만한 배포가 있잖아 ,경쟁심의 명과 암
미친 거 아니(NO:고) 너의 뇌가 하루종일 들어온 (NO:정보)를 정리하는 거야,번 아웃 증후군 퇴치법
그런데 나를 움직이는 동인은 나라는 거야 내가 멋진 커리어를 가진 전문가가 되어야 겠다 이런 목표가 있는 거지 ,번 아웃 증후군 퇴치법
꼭 그렇지 않대 그래서 자기한테 너무 냉혹하고 채찍질만 계속 시키게 된다는 거지 ,번 아웃 증후군 퇴치법
그렇게까지는 아니어도 혼자 있는 시간을 갖고 생각한 대로 행동하고 그러라는 거지 ,번 아웃 증후군 퇴치법
읽을 때도 그래 그런데 읽고 나서 내가 이해했나 돌이켜보면 하나도 모르겠어 ,번 아웃 증후군 퇴치법
맞아 재독 철학자인데 그 사람 개인 스토리는 안 나왔고 아무튼 독일에선 최고 권위자래 ,번 아웃 증후군 퇴치법
나름의 방법을 찾아야지 예전에 나 아는 요가 선생은 아무것도 하지 말고 삼십 분씩 공원에 나가 있으라고 했어 ,번 아웃 증후군 퇴치법
응 지금은 그렇지만 예전에는 나도 너처럼 피폐해졌었어 ,번 아웃 증후군 퇴치법
비건은 동물에게 불필요한 고통을 가하길 원치 않는다는 신념에서 시작됐기 때문에 윤리적인 측면이 강해요,비건식단과 채식식단의 차이
(SP:)식 식 나는 윤리적인 측면보다는 육류보다 채소를 많이 먹어서 건강해지려는 목적이 크거든요,비건식단과 채식식단의 차이
그래서 채소 위주의 가공하지 않은 식품을 주로 먹게 되는 거죠,비건식단과 채식식단의 차이
몸에 좋은 음식을 기준으로 하기 때문에 생선을 먹거나 친환경에서 자란 닭을 먹는 경우도 있어요,비건식단과 채식식단의 차이
건강하고 칼로리가 낮은 식품을 주로 먹기 때문에 소화도 잘되고 다이어트에도 효과가 있거든요,비건식단과 채식식단의 차이
비건이든 채식이든 현대인들의 고질병을 예방하는데 큰 도움이 되거든요,비건식단과 채식식단의 차이
채식 식단은 식이섬유와 칼륨 등 영양소가 풍부해서 (NO:고혈압)을 비롯한 (NO:심)혈관 질환을 예방하는데 도움을 줘요,비건식단과 채식식단의 차이
육식을 하는 사람에 비해 채식을 하는 사람들은 혈중 콜레스테롤 수치가 낮다는 연구결과도 있으니 믿으셔도 될 거예요,비건식단과 채식식단의 차이
고기를 먹지 않으니 콜레스테롤 수치가 떨어지는 건 당연한 일 아닐까요,비건식단과 채식식단의 차이
제 경우는 환경문제에 관심을 갖게 되면서 자연스럽게 비건이 됐어요,비건식단과 채식식단의 차이
축산업이 지구 환경을 더럽히는 주요 원인 중 하나라는 사실을 알게 되니까 고기에 잘 손이 가지 않더라고요,비건식단과 채식식단의 차이
세상이 너무 빨리 변하니까 반려 로봇 나온 얘긴 들었어,반려 로봇 출현
출시된 건 아니고 그 라스베가스에서 열리는 유명한 가전 전시회 있잖아,반려 로봇 출현
응 그냥 뉴스에서 손에 들고 있는 거 봤는데 (NO:공) 모양이더라 ,반려 로봇 출현
뭐 하는 게 많더라고 시큐리티도 하고 (NO:) 스마트폰하고 연동해서 홈 비서 역할을 한대 ,반려 로봇 출현
피트니스 트레이너 뮤직 플레이어 말동무 기능 이런 게 된다나 봐 ,반려 로봇 출현
원래 애완 로봇이 왜 생겼겠니 외로운 사람들의 반려가 되기 위해서지 ,반려 로봇 출현
한 가지 반려견이나 반려묘와 이별을 경험한 사람은 반려 로봇에 관심 가질 수도 있(NO:잖아 ),반려 로봇 출현
그런가 아무튼 그거 발표하면서 집은 사용자의 요구에 반응하고 응답하는 살아있는 생명체와 같다 이런 말을 했어  ,반려 로봇 출현
응 새로운 변화는 (NO:어쩔) 수 없는 거고 우리는 그걸 긍정적으로 바꿔 나갈 거란 기대가 있어 ,반려 로봇 출현
맞아 당연한 것들을 돌아봐야 사회의 그늘이 없어지는 거 같아 ,반려 로봇 출현
아 엊그제 어머님이 전화를 하셨는데 요즘 무릎 통증이 심하다고 하셔서,무릎 통증 관리
사실 나도 등산 한 번씩 다녀오면 요즘은 무릎이 좀 아프더라고 ,무릎 통증 관리
내가 요즘 살이 좀 많이 쪘는데 그래서 무릎에 더 부담이 가는 것 같기도 해,무릎 통증 관리
그런데 무릎이 안 좋으니까 운동도 마음대로 못 하겠더라고,무릎 통증 관리
그렇구나 그런데 수영장까지 가는 건 아무래도 좀 부담인데,무릎 통증 관리
얼마 전에 실내 자전거 타기 운동 기구를 구입했는데 혹시 그런 건 별론가 ,무릎 통증 관리
음식도 신경을 좀 써야할 것 같은데 특별히 좋은 음식이 있나 ,무릎 통증 관리
그건 그렇지만 그래도 도움이 될 만한 음식 종류는 좀 알아 두는 게 좋을 것 같아 ,무릎 통증 관리
오 지금 내가 찾아보니까 비타민이 풍부한 녹색 채소류가 좋다네 ,무릎 통증 관리
견과류도 좋다고 하고 우유나 미역 김 같이 칼슘이 풍부한 음식 육류 등을 골고루 먹으래,무릎 통증 관리
자세 쭈그리고 앉는 자세가 무릎에 가장 치명적이래 ,무릎 통증 관리
걸을 때는 무릎에 체중의 세 배 정도 하중이 실리는데 쪼그려 앉으면 무려 아홉 배의 하중이 실린대  ,무릎 통증 관리
양반다리나 다리를 꼬는 자세도 무릎에 무리를 줄 수 있다니 조심해야 해 ,무릎 통증 관리
응 재활 관리를 열심히 한 덕분인가 수술 전보다 훨씬 좋아지셨어 근데 왜 ,인공관절 수술에 대하여
인공 관절 수명을 대략 이삼십 년 정도로 보거든(NO:),인공관절 수술에 대하여
수술하고 며칠 지나서부터 평행봉 잡고 걷는 연습 시작하셨지 ,인공관절 수술에 대하여
빨리 회복하고 싶다고 진짜 열심히 꾸준히 재활하시더라고,인공관절 수술에 대하여
나도 그런 줄 알았는데 몸을 움직이지 않으면 오히려 관절 근력이 약해진대 ,인공관절 수술에 대하여
우리 어머니도 많이 무서워하셨는데 요즘은 수술 후 통증을 줄여주는 방법이 많이 있나보더라,인공관절 수술에 대하여
그렇지도 않아 바닥에 쪼그리고 (NO:앉거나 양반다리) 같은 자세가 아니면 큰 무리 없던데,인공관절 수술에 대하여
우리 어머니도 당뇨를 앓고 계신데 수술 전에 혈당 관리를 더 철저하게 시키긴 하더라고,인공관절 수술에 대하여
그렇지 않으면 세균 감염 같은 합병증이 생길 위험이 있다고,인공관절 수술에 대하여
(SN:)요를 깔고 개고 바닥에 누웠다 일어나고 (NO:하는 동작들이) 무릎 관절에 꽤 무리가 가거든 ,인공관절 수술에 대하여
(SP:그)그거 좋겠네 (NO:) 너무 무거운 물건을 드는 것도 관절에 부담이 가니 피하시도록 하고 ,인공관절 수술에 대하여
서는 그리 권하지는 않더라고 효과가 확실하게 증명되지는 않았대 ,인공관절 수술에 대하여
맞아 난 일어나기 너무 힘들어서 알람을 일 분 단위로 설정해 놓잖아 ,내 몸을 망치는 안 좋은 아침 습관
내일부턴 정말 일어나는 시간에만 알람을 맞춰놔야겠다 ,내 몸을 망치는 안 좋은 아침 습관
근데 난 눈은 떴어도 침대에서 몸을 일으키는 게 그렇게 어렵더라 ,내 몸을 망치는 안 좋은 아침 습관
한참 동안 침대에서 빈둥빈둥해야 겨우 정신 좀 차리고 일어날 수가 있더라고 ,내 몸을 망치는 안 좋은 아침 습관
아 뭐 그래야 좀 활기차게 아침을 시작할 수 있긴 하겠지 ,내 몸을 망치는 안 좋은 아침 습관
그렇지 잠도 좀 깨야 되고 중요한 연락도 좀 확인하고,내 몸을 망치는 안 좋은 아침 습관
알았어 내일부턴 아침에 알람 한 번에 곧바로 침대에서 일어나서 찬물부터 한 잔 마셔야겠다 ,내 몸을 망치는 안 좋은 아침 습관
찬물 한 잔 시원하게 마시면 잠도 깨고 공복에 물 한 잔 마시는게 좋다던데 ,내 몸을 망치는 안 좋은 아침 습관
정말 안그래도 요즘 소화가 잘 안돼서 고생하고 있었는데 ,내 몸을 망치는 안 좋은 아침 습관
조심해야겠다 그러면 아침에 물을 마시면 안되는 거야 ,내 몸을 망치는 안 좋은 아침 습관
그래도 뭐라도 먹지 않으면 허기져서 출근을 못 하겠더라 ,내 몸을 망치는 안 좋은 아침 습관
오늘 아침엔 어제 먹다 남은 도너츠가 있길래 집어먹고 왔지 ,내 몸을 망치는 안 좋은 아침 습관
아니 왜 이렇게 안되는 게 많아 단 음식은 또 왜 ,내 몸을 망치는 안 좋은 아침 습관
그렇긴 하지 나두 십 년 넘게 아침은 커피 한잔으로 때웠으니까,"커피, 이렇게 마시면 최악!"
그런데 이제부터는 좀 자제하려고,"커피, 이렇게 마시면 최악!"
며칠 전에 과학 유튜브 채널에서 봤는데 모닝 커피가 건강을 해칠 수도 있다네 ,"커피, 이렇게 마시면 최악!"
긴장이나 고통 같은 다양한 스트레스에 맞서 분비되는 호르몬이야 ,"커피, 이렇게 마시면 최악!"
신체에 에너지를 공급해 우리 몸을 활발하게 해주는 역할을 하지 ,"커피, 이렇게 마시면 최악!"
응 코르티솔 호르몬이 왕성하게 분비되는 아침에 커피까지 마시게 되면 신체 각성 작용이 과도해진다는 거지 ,"커피, 이렇게 마시면 최악!"
코르티솔이 가장 적게 분비되는 오전 열 시부터 정오 혹은 오후 두 시부터 다섯 시 사이가 좋대 ,"커피, 이렇게 마시면 최악!"
식사 중이나 식후에 바로 마시는 커피는 철분 흡수를 방해하거든 ,"커피, 이렇게 마시면 최악!"
신진대사가 제대로 이뤄지지 못해서 쉽게 피로감을 느끼게 되고 집중력도 떨어지기 쉽다고 ,"커피, 이렇게 마시면 최악!"
식사하고 나서 최소한 삼십 분 정도 지나서 마시는 게 좋대 ,"커피, 이렇게 마시면 최악!"
그렇지 근데 저번에 보니까 너 회식하고 난 다음날 아침부터 커피 마시고 있더라 ,"커피, 이렇게 마시면 최악!"
그렇지만 건강을 생각한다면 해장 취향도 바꾸는 게 좋을걸 ,"커피, 이렇게 마시면 최악!"
그렇게 생각하기 쉽지만 음주 후엔 수분을 충분히 섭취하는 게 아주 중요하거든 ,"커피, 이렇게 마시면 최악!"
그런데 카페인은 체내 수분 배출하기 작용을 촉진한단 말이야 ,"커피, 이렇게 마시면 최악!"
그래서 우리 몸을 오히려 노곤하고 처지게 만든대,"커피, 이렇게 마시면 최악!"
좋아 그런데 난 미지근한 물을 좀 섞어 줘 ,"커피, 이렇게 마시면 최악!"
주문해서 바로 나오는 뜨거운 커피의 온도가 몇 도나 되는지 알아,"커피, 이렇게 마시면 최악!"
그런데 세계 보건 기구 더블유에이치오에서는 육십오 도 이상의 뜨거운 음료를 발암 물질로 규정하고 있다고 ,"커피, 이렇게 마시면 최악!"
그렇지도 않아 아예 차박이 가능하도록 차 내부를 확장 개조하는 사람들도 있긴 한데,코로나시대의 여행트렌드-차박캠핑
굳이 그러지 않아도 가지고 있는 차를 숙소로 사용할 수 있는 방법이 많더라고 ,코로나시대의 여행트렌드-차박캠핑
차 안에서 자는 게 영 어려우면 차량 위에 설치하는 루프톱 텐트 같은 것도 있어,코로나시대의 여행트렌드-차박캠핑
응 나도 처음엔 걱정을 많이 했는데 생각보다 너무 좋았어,코로나시대의 여행트렌드-차박캠핑
요즘은 차박이 인기를 끌면서 품질 좋은 매트가 많이 나온대 ,코로나시대의 여행트렌드-차박캠핑
나도 이번에 처음 사용해 봤는데 생각보다 푹신하고 안정적이더라 ,코로나시대의 여행트렌드-차박캠핑
일반 텐트가 비교적 가격도 저렴하고 원하는 크기의 텐트를 설치할 수 있다는 장점도 있지,코로나시대의 여행트렌드-차박캠핑
다만 땅에서 올라오는 한기에 약하고 눈비가 많이 올 경우엔 설치가 어렵다는 단점이 있어,코로나시대의 여행트렌드-차박캠핑
아니야 그러면 차 뒷자리랑 트렁크를 연결해서 잘 자리를 만들면 돼 ,코로나시대의 여행트렌드-차박캠핑
두 명 정도는 소형차로도 얼마든지 차박 캠핑이 가능하더라 ,코로나시대의 여행트렌드-차박캠핑
짐이 너무 많아도 번거로워서 최소한의 물품을 효율적으로 챙기는 게 좋긴 해 ,코로나시대의 여행트렌드-차박캠핑
다만 접이식 테이블이나 의자 매트와 침낭 취사도구 같은 건 기본적으로 챙겨야지 ,코로나시대의 여행트렌드-차박캠핑
랜턴이랑 휴대용 배터리 상비약 같은 것도 챙기는 게 좋아,코로나시대의 여행트렌드-차박캠핑
벌레 퇴치제나 연고 같은 것들을 가져가면 유용하더라고 ,코로나시대의 여행트렌드-차박캠핑
캠핑 요리가 얼마나 다양한데 물론 삼겹살에 차가운 맥주 한잔이면 뭐 더 이상 바랄 게 없긴 하지만 ,코로나시대의 여행트렌드-차박캠핑
그렇지 나도 여름휴가 땐 종종 해외여행을 갔었는데 이번엔 못 갔어 ,코로나 시대의 이색 여행 상품
와 비행기 구십 분 타고 내리는데 그 돈을 낸다고 ,코로나 시대의 이색 여행 상품
대박 나도 지금 검색해봤는데 비행하는 척 서비스만 있는게 아니네 ,코로나 시대의 이색 여행 상품
캐나다의 어느 항공사에서는 냉동 기내식 배달 서비스를 시작했대,코로나 시대의 이색 여행 상품
맥앤치즈 고구마 스튜 같이 실제 이 항공사에서 제공하는 기내식 메뉴들을 배달해 준대 ,코로나 시대의 이색 여행 상품
여행 때 맛본 기내식의 맛을 그리워하는 사람들이 꽤 많이 이용한다는데 ,코로나 시대의 이색 여행 상품
코로나 때문에 냉동 음식을 대폭 저장해 두려는 사람들한테도 인기래,코로나 시대의 이색 여행 상품
기내에서 제공되는 아몬드 같은 먹거리랑 비즈니스 클래스용 잠옷하고 로션을 패키지로 팔았대,코로나 시대의 이색 여행 상품
사실 코로나 때문에 직격탄을 맞은 업계가 항공업계긴 하니까  ,코로나 시대의 이색 여행 상품
응 매운 음식을 먹으면 통증에 대응하기 위해서 우리 몸에서 엔도르핀을 분비하는 거야 ,매운 음식 열전
칼칼한 고춧가루를 듬뿍 넣은 매운 낙지볶음에 콩나물이랑 밥을 슥슥 비벼서 먹으면… ,매운 음식 열전
부드러운 살코기와 쫀득한 껍데기에 매운맛 양념의 조화,매운 음식 열전
맞아 주인 아저씨가 그러는데 완뽕 도전하다가 기절하는 사람도 많대,매운 음식 열전
집에서 먹는 거니 아주 편한 옷차림으로 땡초 라면에 맥주 한잔 마시고 나면 천국이 따로 없다,매운 음식 열전
맞아 요즘은 매운맛 강도를 조절할 수 있는 떡볶이 가게도 많더라 ,매운 음식 열전
어우 침 넘어간다 말만 하지 말고 직접 해 주면 안돼 ,매운 음식 열전
오늘 글쎄 내 생일도 아니고 니 생일도 아니고 무슨 날인데,계란 보관법
빼빼로데이 로즈데이 별별 데이가 다 있더니 이제 계란 먹는 날도 다 생겼구나,계란 보관법
나둔데 마땅히 먹을게 없을 때 계란만 있어도 든든하더라고 ,계란 보관법
좀 신경쓰면 계란말이나 계란찜 아니면 계란프라이라도 ,계란 보관법
