stt,thema
난 거의 매일 먹는 것 같긴 한데 일 년이면 삼백 개는 먹을 것 같아 ,계란 보관법
왜 거기 두는 게 좋으니까 알아서 보관 자리를 만들어 둔 거 아니야 ,계란 보관법
낮은 온도와 높은 습도 그렇게 애매하게 말하면 누가 알아 먹어 구체적으로 몇 도 ,계란 보관법
냉장고 안의 음식 냄새가 계란으로 흡수되는 것을 막아줄 수 있다며,계란 보관법
내가 가장 즐겨먹는 건 오른손으로 비비고~ 왼손으로 비비고~ ,맛있는 야식 꿀조합
너 나랑 좀 통한다 비빔면 다음으로 내가 좋아하는 야식은 역시 치느님 ,맛있는 야식 꿀조합
난 역시 밥심이 중요한 한국 사람이라 치킨 먹을 때도 밥이 있어야 돼 ,맛있는 야식 꿀조합
뭔데 뭔데 안 그래도 조금 색다른 맛 없나 고민 중이었는데 ,맛있는 야식 꿀조합
근데 가끔은 배달이 안 될 정도로 늦은 시간인데 배가 엄청 고플 때 있잖아 ,맛있는 야식 꿀조합
내가 요즘 새로 터득한 건 짜장라면이랑 불닭볶음면 섞어 먹기 ,맛있는 야식 꿀조합
단 혼자서 이거 다 먹으면 다음날 얼굴 땡땡 부을 수 있다 ,맛있는 야식 꿀조합
그건 그래 가끔 단 음식이 땡길 땐 편의점 모찌롤이랑 초코우유 조합도 괜찮아 ,맛있는 야식 꿀조합
난 내가 라면 끓였는데 한입 달라는 사람이 더 얄밉던데 ,라면의 비밀
칠십 개면 뭐 대충 오 일에서 일주일 사이에 하나 먹는 거네 ,라면의 비밀
그럼 국수 파스타 우동 그런 것들은 다 면발이 직선이잖아 ,라면의 비밀
이렇게 긴 면발을 작은 봉지 안에 넣으려면 꼬불거리는 형태로 만들어야 된다는 거지,라면의 비밀
그래서 바람이 잘 통하기 때문에 쉽게 건조할 수 있고 기름에도 잘 튀겨진대 ,라면의 비밀
직선으로 된 면에 비해 냄비 바닥에 덜 달라붙는다는 장점이 있어 ,라면의 비밀
뜨거운 물을 부었을 때 안쪽 용기는 열이 밖으로 나가지 않게 도와주는 용도 ,라면의 비밀
그건 그렇지 그래서 요즘 컵라면은 종이 재질로 많이 바뀌는 것 같던데 ,라면의 비밀
그치 너무 맘에 들어서 예전부터 찜 해놨던 건데 저렴하게 살 수 있는 기회가 생겨서 ,생활비 아끼는 꿀팁-하자제품 구매 
이 노트북도 누가 반품한 리퍼브 제품이라 싸게 파는 거 산 거야 ,생활비 아끼는 꿀팁-하자제품 구매 
그럼 매장에 전시해 놨던 제품도 있고 내가 산 것처럼 누가 샀다가 반품한 경우도 있고 ,생활비 아끼는 꿀팁-하자제품 구매 
보통 전자 제품은 박스를 뜯으면 그 순간에 중고 되는 거거든 ,생활비 아끼는 꿀팁-하자제품 구매 
당연하지 반 가격인 것도 흔하고 최대 팔십 프로까지 싼 것들도 있던데 ,생활비 아끼는 꿀팁-하자제품 구매 
요즘은 리퍼브 제품만 전문적으로 판매하는 매장이 꽤 많아 ,생활비 아끼는 꿀팁-하자제품 구매 
사고 싶은 게 있으면 일단 그런 곳을 검색해서 찾아가 보면 도움이 될걸 ,생활비 아끼는 꿀팁-하자제품 구매 
(NO:)고객이 사용하던 이케아 가구를 매장에 재판매하면 이케아가 이걸 수선해서 다시 유통시키는 서비스래,생활비 아끼는 꿀팁-하자제품 구매 
새 상품보다 저렴한 가격이지만 이케아가 싹 손을 봐서 깔끔하게 만든 제품인 거지 ,생활비 아끼는 꿀팁-하자제품 구매 
그러게 말이야 나도 필요한 가구가 있었는데 그 서비스를 한번 이용해 보려고 ,생활비 아끼는 꿀팁-하자제품 구매 
너도 복권 당첨되면 나한테 벤츠 한 대 사준단 얘기 백 번쯤 한 것 같은데 ,내가 복권에 당첨된다면? 
당연하지 그 영국 할아버지야 미국 복권에 당첨됐으니까 당첨금도 어마어마했지만 ,내가 복권에 당첨된다면? 
솔직히 요즘 우리 나라에선 복권 당첨돼 봐야 얼마 안될걸 ,내가 복권에 당첨된다면? 
바로 그거야 쫄리면 뭐 사표낸다 그 생각만으로도 좀 든든할 것 같아,내가 복권에 당첨된다면? 
맞아 미국의 어떤 부부도 엄청난 액수의 복권에 당첨됐는데 하나도 변한 게 없이 살고 있다던데 ,내가 복권에 당첨된다면? 
심지어 살던 집도 그대로 차만 좀 좋은 걸로 바꿨다던가 ,내가 복권에 당첨된다면? 
물론 너무 돈이 없어도 힘들겠지만 어느 정도 이상이 되면 큰 차이가 없다더라고,내가 복권에 당첨된다면? 
그렇지 복권 당첨금 때문에 주변 사람들과 갈등이 생겨서 불행해진 사례도 꽤 있더라고,내가 복권에 당첨된다면? 
자 내가 선물로 한 장 사 줄게 대신 당첨되면 나랑 절반으로 나누는거다 ,내가 복권에 당첨된다면? 
응응 궁금하다 와 사진 보니까 진짜 멋있다,한국전쟁 당시 참전 여성들
우와 구월산 여장군이라니 별명도 진짜 대단하다,한국전쟁 당시 참전 여성들
이야 진짜 끝내준다 누가 여자들 전쟁 때 숨어있었다고 하면 말해 줘야지,한국전쟁 당시 참전 여성들
아니 국제 정세 보려면 읽기는 해야 하는데 생각보다 잘 안 읽게 되네,외국 신문 선호도
그 무슨 혁신 보고서인가 나오고 나서부터 달라지기 시작했던데,외국 신문 선호도
티비편성표가 더는 사람들의 티비 시청 방식을 반영하지 못한다,외국 신문 선호도
이야 증권가 찌라시가 진화하고 진화하고 진화해 완전체가 된 것 같지 않아,외국 신문 선호도
아마도 이 차는 피피엘 아니고 주인공 성격 표현하려고 정했을걸,드라마 피피엘
돈을 많이 버는 마약제조범이 안탈 것 같은 눈에 띄지 않는 차가 필요했던 거겠지,드라마 피피엘
맞아 평범한 직업을 가진 중년 남자가 극한 상황에서 가족 지키는 이야기,드라마 피피엘
아마 그럴걸 이십대 미국 남성들에게 어필하는 캐릭터가 그렇다고 분석해 놓은 기사 봤어 ,드라마 피피엘
그러니까 가끔은 내가 드라마를 보는 건지 광고를 보는 건지 모르겠더라고,드라마 피피엘
응 인기를 끌면 막판에 광고주들이 막 붙는대 그래서 더 많아지는 거래,드라마 피피엘
맞아 이제 공중파 방송국은 영향력이 없어 차라리 유튜버가 낫지,드라마 피피엘
야 그 소리는 '카페나 차려 볼까' 하는 말이랑 똑같은 거야 얼마나 힘든데,드라마 피피엘
어 그러니까 안 그래도 그거 물어보더라 당장 일월부터 일해야 하는데 가능하냐고,퇴직 고민
그만큼 하고 싶은 일인지 아직 잘 모르겠어 애들도 걸리고 애들은 절대 반대래,퇴직 고민
나는 이번에 깨달은 게 지금 당장 나한테 필요한 건 성장이나 성취가 아니라 돌봄이라는거,퇴직 고민
옛날에 새로운 거 불안하고 걱정되기도 하지만 엄청 흥분되고 짜릿했거든,퇴직 고민
하고 싶어서 안달나고 그랬는데 지금은 스트레스로 너무 힘들어서 온몸에서 경련이 나더라고,퇴직 고민
그래 나는 성공이라든가 명예는 관심 없는데 성취욕구가 강하거든,퇴직 고민
그걸 못하면 병이 나 근데 하면서 나를 갈아넣어서 또 병이 나 이게 뭐니,퇴직 고민
응 그러니까 지금 재만 남은 기분이야 몸은 또 안돌아가고,퇴직 고민
어차피 될지 안 될지도 모르지만 일련의 과정을 끝냈다는 것만으로도 넘나 속 시원해,퇴직 고민
어제 부사장이랑 한바탕했어이러다가 본부장이랑 나랑 둘 중의 하나가 미치든 할 거 같아,퇴직 고민
아니 중요한 결정 구조는 다 자기가 쥐고 있으면서 나한테 할거냐고 하면 어떻게 해,퇴직 고민
자기가 외주자 써서 핸들링한다고 하는데 그 사람들이 그게 가능하냐고,퇴직 고민
그래서 본부장이 옆에서 듣고 있다가 언제요 그랬더니 같이 들었잖아요 그랬대,퇴직 고민
이건 말하지마 나 없는 사이에 내 밑에 직원 시켜서 프로젝트 빼가고,퇴직 고민
어 외근 나갔다가 돌아왔더니만 직원이 그러더라고 내가 주라고 그랬대,퇴직 고민
